{
  "schema_version": "1.0",
  "job_id": "job-full-001",
  "trace_id": "trace-0002",
  "job_type": "FULL_CHECK",
  "status": "SUCCEEDED",
  "execution": {
    "created_at": "2026-09-16T10:00:00Z",
    "started_at": "2026-09-16T10:00:03Z",
    "finished_at": "2026-09-16T10:02:17Z"
  },
  "input": {
    "repository": {
      "url": "https://github.com/example/project.git",
      "commit": "89abcdef0123456789abcdef0123456789abcdef"
    },
    "environment": {
      "image_uri": "docker://example/project:89abcde",
      "workdir": "/workspace/project",
      "configuration_id": "gcc-default",
      "clean_build_command": "make clean && make -j4",
      "timeout_seconds": 1800
    }
  },
  "output": {
    "actual_graph": {
      "artifact_id": "actual-001",
      "type": "ACTUAL_GRAPH",
      "uri": "artifact://example/full001/actual.json",
      "media_type": "application/json",
      "producer_job_id": "job-full-001",
      "repository_commit": "89abcdef0123456789abcdef0123456789abcdef",
      "configuration_id": "gcc-default"
    },
    "declared_graph": {
      "artifact_id": "declared-001",
      "type": "DECLARED_GRAPH",
      "uri": "artifact://example/full001/declared.json",
      "media_type": "application/json",
      "producer_job_id": "job-full-001",
      "repository_commit": "89abcdef0123456789abcdef0123456789abcdef",
      "configuration_id": "gcc-default"
    },
    "finding_report": {
      "artifact_id": "md-report-001",
      "type": "ERROR_REPORT",
      "uri": "artifact://example/full001/md-report.json",
      "media_type": "application/json",
      "producer_job_id": "job-full-001",
      "repository_commit": "89abcdef0123456789abcdef0123456789abcdef",
      "configuration_id": "gcc-default"
    },
    "findings": [
      {
        "finding_id": "finding-001",
        "type": "MISSING",
        "target": "src/main.o",
        "dependency": "include/config.h",
        "repository_commit": "89abcdef0123456789abcdef0123456789abcdef",
        "configuration_id": "gcc-default",
        "detector": "BUILDCHECKER",
        "declaration_location": "Makefile:12",
        "evidence": {
          "actual_dependency": true,
          "declared_dependency": false,
          "artifact_uri": "artifact://example/full001/evidence/finding-001.json"
        }
      }
    ],
    "summary": { "missing": 1, "redundant": 0 }
  },
  "error": null
}
